Term import ID	Synonym	S xref	Narrow synonym	NS xref	Broad synonym	BS xref	Related synonym	RS xref
ID	A oboInOwl:hasExactSynonym SPLIT=|	>A oboInOwl:hasDbXref SPLIT=|	A oboInOwl:hasNarrowSynonym SPLIT=|	>A oboInOwl:hasDbXref SPLIT=|	A oboInOwl:hasBroadSynonym SPLIT=|	>A oboInOwl:hasDbXref SPLIT=|	A oboInOwl:hasRelatedSynonym SPLIT=|	>A oboInOwl:hasDbXref SPLIT=|
FYPO:0007561	hypersensitive to chaetoglobosin D|sensitive to chaetoglobosin D during vegetative growth	PomBase:mah					sensitive to chaetoglobosin D during mitotic cell cycle	PomBase:mah
FYPO:0007562	hypersensitive to serine|sensitive to serine during vegetative growth|sensitive to L-serine	PomBase:mah					sensitive to serine during mitotic cell cycle	PomBase:mah
FYPO:0007563	cell cycle arrest in mitotic G1 phase in response to pheromone in absence of starvation|pheromone-induced mitotic cell cycle arrest in mitotic G1 phase without starvation	PomBase:mah						
FYPO:0007563					mitotic cell cycle arrest in response to pheromone in absence of starvation	PomBase:al		
