Term import ID	Synonym	S xref	Narrow synonym	NS xref	Broad synonym	BS xref	Related synonym	RS xref
ID	A oboInOwl:hasExactSynonym SPLIT=|	>A oboInOwl:hasDbXref SPLIT=|	A oboInOwl:hasNarrowSynonym SPLIT=|	>A oboInOwl:hasDbXref SPLIT=|	A oboInOwl:hasBroadSynonym SPLIT=|	>A oboInOwl:hasDbXref SPLIT=|	A oboInOwl:hasRelatedSynonym SPLIT=|	>A oboInOwl:hasDbXref SPLIT=|
FYPO:0001976	normal cytoplasmic microtubule morphology during vegetative growth|normal cytoplasmic microtubules during vegetative growth	PomBase:mah	normal cytoplasmic microtubule structure during vegetative growth NARROW	PomBase:mah				
FYPO:0007809	normal cytoplasmic microtubule morphology during cellular response to pheromone|normal cytoplasmic microtubules during response to pheromone|normal microtubules during cellular response to pheromone	PomBase:mah	normal cytoplasmic microtubule structure during cellular response to pheromone	PomBase:mah			normal cytoplasmic microtubules during mating projection formation	PomBase:vw
FYPO:0007811	decreased Cdc45-MCM-GINS helicase activity|decreased Cdc45-MCM-GINS replicative helicase activity|decreased replicative helicase activity|decreased 3'-5' DNA helicase activity during DNA replication	PomBase:mah						
FYPO:0007812	hypersensitive to stavudine|sensitive to stavudine during vegetative growth	PomBase:mah					sensitive to stavudine during mitotic cell cycle	PomBase:mah
FYPO:0007813	normal cell population growth on stavudine	PomBase:al|PomBase:mah|PomBase:vw						
FYPO:0007813	normal cell population growth in presence of stavudine|normal vegetative cell population growth on stavudine	PomBase:mah						
FYPO:0007814	increased rate of DNA strand elongation involved in mitotic DNA replication during cellular response to hydroxyurea|increased rate of mitotic DNA replication elongation during cellular response to hydroxyurea during vegetative growth|increased rate of mitotic DNA replication elongation during cellular response to HU	PomBase:mah					increased rate of DNA replication elongation during cellular response to hydroxyurea during mitotic cell cycle	PomBase:mah
FYPO:0007814	increased rate of DNA strand elongation involved in nuclear cell cycle DNA replication during cellular response to hydroxyurea	GO:1902319						
