Term import ID	Synonym	S xref	Narrow synonym	NS xref	Broad synonym	BS xref	Related synonym	RS xref
ID	A oboInOwl:hasExactSynonym SPLIT=|	>A oboInOwl:hasDbXref SPLIT=|	A oboInOwl:hasNarrowSynonym SPLIT=|	>A oboInOwl:hasDbXref SPLIT=|	A oboInOwl:hasBroadSynonym SPLIT=|	>A oboInOwl:hasDbXref SPLIT=|	A oboInOwl:hasRelatedSynonym SPLIT=|	>A oboInOwl:hasDbXref SPLIT=|
FYPO:0007804	abnormal histone H3-H4 dimer loading activity|abnormal H3-H4 dimer loading activity	PomBase:mah						
FYPO:0007805	abolished histone H3-H4 dimer loading activity|abolished H3-H4 dimer loading activity	PomBase:mah						
FYPO:0007808	resistance to valproic acid during vegetative growth	PomBase:mah					resistance to valproic acid during mitotic cell cycle	PomBase:mah
FYPO:0005593	increased cellular IPC level	PMID:34114004						
